,comment
0,"fui a un resort poco tomando sin parar obtener habitaciones necesito traer golf más pequeño tomar una habitación área de playa necesita habitaciones de un resort poco limpiar como el clima semana una semana encontré variedad nunca fui semana dio agua más pequeña uno calentaría tomó agua helada mantener encontrado bares de cerveza bueno llamado semana de la cerveza agradable bueno dio cerveza también bueno dejó cosas bien las bebidas obtendrían como vistas habitaciones hermosa área de playa agradable frente obtener reserva temprana por lo general se quedó el sol viene bastante agradable a nosotros a los demás les puede gustar mucho servicio playa muchos podrían bucear en la playa derecha buenos peces ver muchos peces pequeños bastante divertido ver diferentes cosas fueron piscina tienda usar playa agua cálida genial alrededor seguro ver Habitualmente comía mucho, cenaba, bebía, sala, lo pasamos muy bien. Recomendaría el resort, el golf, se divirtió, chicos."
1,muchos buenos complejos turísticos muchos restaurantes buena comida buenas compras playas corrientes a menudo fuertes para nadar áreas sin océano a través de excursiones privadas de un día cortas
2,bahía variedad playa áreas para nadar días de snorkel calma claro otros relajante familia
3,playa larga gente de playa surfear áspero pareja manchas poco sombra natural pareja restaurantes tomar sol larga fila surfear buen lugar formaciones rocosas agua mirar
4,amor bahía agua cálida limpia genial tiempos difíciles cuidado pagar cada vez más tranquilo frente sueños alimentar peces comida para peces alrededor gran experiencia
5,Me alojé en un pequeño hotel cerca de la playa Acceso encantador a la playa Resorts inclusivos Mejor acceso Área de restaurantes que vale la pena visitar
6,hermosa bahía limpia todo el día acceso público bahía playa accesible uno resorts ir temprano uno disponible tiempo de playa ubicación olas tranquilo buenos niños nadar excelente snorkel ver peces playa
7,frente derecho hotel inclusivo encuentre un extremo de la playa un paseo encuentre excelentes áreas para nadar hoteles inclusivos a lo largo de la playa incluido el parque de los sueños la mejor manera de desplazarse quiere taxis
8,grupo familiar barco privado llévanos a la playa hermoso tranquilo hacer snorkel podría llevar tiempo parque lleno genial limpio relajante día divertido tómate el tiempo conseguir barco
9,bahías vistas favoritas agua bastante grande limpias rocas parte favorita pez nadado cerca alimentar experiencia cercana incluyendo muchos marinos muchas personas agua alto absolutamente amado
10,hermosa playa resaca extremadamente fuerte rocas cuidadosas ver balneario peligroso sería genial ver a todos disfrutar del paisaje
11,área alrededor hermosa y extremadamente limpia visita segura uso del tiempo playa excelentes áreas de vigilancia entrada segura a centros turísticos acuáticos horario de playa limitado debido
12,amado playa olas alto ver resaca rojo la gente todavía profundiza nadar lejos lugar peligroso nadar lejos amado larga playa de arena
13,Parte de los hoteles alineados Buceo decente alrededor de la isla a lo largo de las rocas Frente a los sueños Acceso al hotel Barcos de pesca necesitan snorkel Arena Pequeñas playas de campo Muchos complejos turísticos La playa todavía está llena
14,Definitivamente ven hermoso nunca vayas acceso público toma trae tosco inclinado resorts de playa restaurantes de playa privado público incluso deja de conseguir agua tiempo lejos zapatos playa
15,"Lo mejor de nunca, chicos, playa, los mejores tours por la bahía, gente increíble, comida."
16,buena playa de arena larga y limpia que vale la pena visitar nadar caminar caminó por un extremo cerca del atardecer hermoso camino de acceso tableros públicos camino de tablas caminar área plana acceso público incluso remolque cerca del camino de acceso camino podría acceder a la playa uno hoteles frente al público turistas hoteles frente a la playa mejor
17,excelentes playas cerca de los principales centros turísticos
18,Siempre quédese en la bahía Mire absolutamente la playa en barco haga un recorrido por las bahías practique snorkel pesca incluso increíbles playas en barco agua cerca el tiempo pasado océano regreso por favor asegúrese de tiempo
19,Me alojé en la bahía del complejo excelente playa Playa de agua cálida Resort de sueños Mirada del complejo Playa generalmente frente Impresionante bote Hacer recorrido por las bahías Ver suficiente Ver Ir a bucear Ir a nadar hermosas playas Barco accesible Día increíble Salí del resort Regresé alrededor Familia Niños Excelente momento
20,"lejos, uno de los lugareños amigables favoritos, excelente espalda, luce un gran lugar"
21,una zona de bahías hermosas playas zona de la bahía de ballenas agua cálida
22,quedarse en la bahía como playa privada roca descanso en la playa frente de arena hoteles principales gente de la bahía extremo de la playa formaciones rocosas de la bahía accesible playas del hotel público hace parte privado arena plana soltar agua cerrar océano relativamente tranquilo debido descanso de la bahía gente de la playa
23,playa para nadar playa a través del camino de viaje pagar a través de un hotel final del camino parque de remolques tablas arena vale la pena llegar a la bahía
24,"Me quedé en la bahía de los sueños, maravillosa, hermosa, gran playa, muchos peces, trae para nadar, bahías adecuadas, hermosas y naturales."
25,playa hermosa quiero que uno se quede uno resorts acceso a la playa mejor ir pequeño parque de casas rodantes caminar muchos vienen valla derecha caminar a lo largo de otro por favor a lo largo de la cerca camino a lo largo caminar de manera uniforme pensar lugares playa acceso público gente difícil limitado pequeño paquete atrás por favor mire
26,Love Bay Area Resort nos dio acceso a la zona agradable ir a caminar comprobar visitar restaurantes bares detener cafeterías de hielo como un pequeño pueblo resort alejarse camino bordeado encontrar un pequeño parque cerca del área área segura local derecho a menudo se realizaron caminatas cena nunca bahía grande un día a menudo caminaba por la playa buena hermosa bahía
27,familia a los niños les encantó vio tipo fueron paseo en bote los niños vieron tortugas muchos lugares de peces se quedaron nosotros en la bahía a los niños les encantó el lugar playas visitaron playas bahía uno mejor agua clara ver peces correcto familia regresa lugar siguiente ver visitar ballenas visitar la bahía cosas familiares a menudo consiguen que la gente cercana nos ayude fue camino nosotros lugar de belleza fue uno cercano fresco derecho área de compras muy divertido los niños disfrutaron
28,me quedé en la bahía de los sueños estupenda playa divertida océano bucear con snorkel pescar
29,resorts bahía sueños hermosas vistas
30,ir a la playa hospedarse incluido personal amable ver grupo hotelero dinero querría visitar la playa piscina restaurante ingresar a la bahía a través del parque de casas rodantes acceso a la playa pública realmente área caminar a lo largo de la cerca como dinero ir a una parte diferente área como hacer un viaje en bote quiero turistas una bahía realmente los hoteles tratan como un lugar
31,"Me quedé en Dreams Resort Bay. Me encantó la zona segura, tranquila y hermosa. Vi una gran variedad y disfruté nadando."
32,visitar lugar alrededor buena comida gente gente agradable buena oferta caro
33,hermosa playa ubicada en la bahía lugares perfectos para nadar lugares fantásticos para bucear arena fina lo mejor alrededor de la playa
34,toda la bahía área segura stand día día clima hermosas vistas lugar
35,bahía hermoso snorkel derecho resort sueños agua clara hermoso ver derecho marino recomendaría lugar snorkel
36,zona de playas hermosa necesito quedarme clima lugares encantadores como visitar la parte difícil volver
37,"fui a un resort poco tomando sin parar obtener habitaciones necesito traer golf más pequeño tomar una habitación área de playa necesita habitaciones de un resort poco limpiar como el clima semana una semana encontré variedad nunca fui semana dio agua más pequeña uno calentaría tomó agua helada mantener encontrado bares de cerveza bueno llamado semana de la cerveza agradable bueno dio cerveza también bueno dejó cosas bien las bebidas obtendrían como vistas habitaciones hermosa área de playa agradable frente obtener reserva temprana por lo general se quedó el sol viene bastante agradable a nosotros a los demás les puede gustar mucho servicio playa muchos podrían bucear en la playa derecha buenos peces ver muchos peces pequeños bastante divertido ver diferentes cosas fueron piscina tienda usar playa agua cálida genial alrededor seguro ver Habitualmente comía mucho, cenaba, bebía, sala, lo pasamos muy bien. Recomendaría el resort, el golf, se divirtió, chicos."
38,muchos buenos complejos turísticos muchos restaurantes buena comida buenas compras playas corrientes a menudo fuertes para nadar áreas sin océano a través de excursiones privadas de un día cortas
39,bahía variedad playa áreas para nadar días de snorkel calma claro otros relajante familia
40,playa larga gente de playa surfear áspero pareja manchas poco sombra natural pareja restaurantes tomar sol larga fila surfear buen lugar formaciones rocosas agua mirar
41,amor bahía agua cálida limpia genial tiempos difíciles cuidado pagar cada vez más tranquilo frente sueños alimentar peces comida para peces alrededor gran experiencia
42,Me alojé en un pequeño hotel cerca de la playa Acceso encantador a la playa Resorts inclusivos Mejor acceso Área de restaurantes que vale la pena visitar
43,hermosa bahía limpia todo el día acceso público bahía playa accesible uno resorts ir temprano uno disponible tiempo de playa ubicación olas tranquilo buenos niños nadar excelente snorkel ver peces playa
44,frente derecho hotel inclusivo encuentre un extremo de la playa un paseo encuentre excelentes áreas para nadar hoteles inclusivos a lo largo de la playa incluido el parque de los sueños la mejor manera de desplazarse quiere taxis
45,grupo familiar barco privado llévanos a la playa hermoso tranquilo hacer snorkel podría llevar tiempo parque lleno genial limpio relajante día divertido tómate el tiempo conseguir barco
46,bahías vistas favoritas agua bastante grande limpias rocas parte favorita pez nadado cerca alimentar experiencia cercana incluyendo muchos marinos muchas personas agua alto absolutamente amado
47,hermosa playa resaca extremadamente fuerte rocas cuidadosas ver balneario peligroso sería genial ver a todos disfrutar del paisaje
48,área alrededor hermosa y extremadamente limpia visita segura uso del tiempo playa excelentes áreas de vigilancia entrada segura a centros turísticos acuáticos horario de playa limitado debido
49,amado playa olas alto ver resaca rojo la gente todavía profundiza nadar lejos lugar peligroso nadar lejos amado larga playa de arena
50,Parte de los hoteles alineados Buceo decente alrededor de la isla a lo largo de las rocas Frente a los sueños Acceso al hotel Barcos de pesca necesitan snorkel Arena Pequeñas playas de campo Muchos complejos turísticos La playa todavía está llena
51,Definitivamente ven hermoso nunca vayas acceso público toma trae tosco inclinado resorts de playa restaurantes de playa privado público incluso deja de conseguir agua tiempo lejos zapatos playa
52,"Lo mejor de nunca, chicos, playa, los mejores tours por la bahía, gente increíble, comida."
53,buena playa de arena larga y limpia que vale la pena visitar nadar caminar caminó por un extremo cerca del atardecer hermoso camino de acceso tableros públicos camino de tablas caminar área plana acceso público incluso remolque cerca del camino de acceso camino podría acceder a la playa uno hoteles frente al público turistas hoteles frente a la playa mejor
54,excelentes playas cerca de los principales centros turísticos
55,Siempre quédese en la bahía Mire absolutamente la playa en barco haga un recorrido por las bahías practique snorkel pesca incluso increíbles playas en barco agua cerca el tiempo pasado océano regreso por favor asegúrese de tiempo
56,Me alojé en la bahía del complejo excelente playa Playa de agua cálida Resort de sueños Mirada del complejo Playa generalmente frente Impresionante bote Hacer recorrido por las bahías Ver suficiente Ver Ir a bucear Ir a nadar hermosas playas Barco accesible Día increíble Salí del resort Regresé alrededor Familia Niños Excelente momento
57,"lejos, uno de los lugareños amigables favoritos, excelente espalda, luce un gran lugar"
58,una zona de bahías hermosas playas zona de la bahía de ballenas agua cálida
59,quedarse en la bahía como playa privada roca descanso en la playa frente de arena hoteles principales gente de la bahía extremo de la playa formaciones rocosas de la bahía accesible playas del hotel público hace parte privado arena plana soltar agua cerrar océano relativamente tranquilo debido descanso de la bahía gente de la playa
60,playa para nadar playa a través del camino de viaje pagar a través de un hotel final del camino parque de remolques tablas arena vale la pena llegar a la bahía
61,"Me quedé en la bahía de los sueños, maravillosa, hermosa, gran playa, muchos peces, trae para nadar, bahías adecuadas, hermosas y naturales."
62,playa hermosa quiero que uno se quede uno resorts acceso a la playa mejor ir pequeño parque de casas rodantes caminar muchos vienen valla derecha caminar a lo largo de otro por favor a lo largo de la cerca camino a lo largo caminar de manera uniforme pensar lugares playa acceso público gente difícil limitado pequeño paquete atrás por favor mire
63,Love Bay Area Resort nos dio acceso a la zona agradable ir a caminar comprobar visitar restaurantes bares detener cafeterías de hielo como un pequeño pueblo resort alejarse camino bordeado encontrar un pequeño parque cerca del área área segura local derecho a menudo se realizaron caminatas cena nunca bahía grande un día a menudo caminaba por la playa buena hermosa bahía
64,familia a los niños les encantó vio tipo fueron paseo en bote los niños vieron tortugas muchos lugares de peces se quedaron nosotros en la bahía a los niños les encantó el lugar playas visitaron playas bahía uno mejor agua clara ver peces correcto familia regresa lugar siguiente ver visitar ballenas visitar la bahía cosas familiares a menudo consiguen que la gente cercana nos ayude fue camino nosotros lugar de belleza fue uno cercano fresco derecho área de compras muy divertido los niños disfrutaron
65,me quedé en la bahía de los sueños estupenda playa divertida océano bucear con snorkel pescar
66,resorts bahía sueños hermosas vistas
67,ir a la playa hospedarse incluido personal amable ver grupo hotelero dinero querría visitar la playa piscina restaurante ingresar a la bahía a través del parque de casas rodantes acceso a la playa pública realmente área caminar a lo largo de la cerca como dinero ir a una parte diferente área como hacer un viaje en bote quiero turistas una bahía realmente los hoteles tratan como un lugar
68,"Me quedé en Dreams Resort Bay. Me encantó la zona segura, tranquila y hermosa. Vi una gran variedad y disfruté nadando."
69,visitar lugar alrededor buena comida gente gente agradable buena oferta caro
70,hermosa playa ubicada en la bahía lugares perfectos para nadar lugares fantásticos para bucear arena fina lo mejor alrededor de la playa
71,toda la bahía área segura stand día día clima hermosas vistas lugar
72,bahía hermoso snorkel derecho resort sueños agua clara hermoso ver derecho marino recomendaría lugar snorkel
73,zona de playas hermosa necesito quedarme clima lugares encantadores como visitar la parte difícil volver
74,volver cerca de la estancia estancia por noche por día incluido el día del hotel
75,hotel parque hermosa bahía disfruté buceando bahía sierra peces agua áspera
76,bahía excelente mañana disfrutar gente diferente clima agua
77,isla hacer snorkel alrededor lotes ver playa lado largo playa inclusiva hoteles acceso a sueños restaurantes de playa comer almuerzo para llevar traer área de entrega acceso a playa pública próximo campo de golf área para caminar llegar a la playa
78,Realmente disfruté playa océano mucho más tranquilo visita océano cálido buena agua arena gruesa poco difícil caminata excelentes actividades acuáticas mucho snorkel hoteles en gran bahía
79,fantásticos restaurantes de playa bonito paseo alojarse en hoteles de ensueño
80,"Maravillosa semana, pasé un día, visité mucho la playa, pasé mucho tiempo mirando la bahía."
81,hotel justo en la bahía bastante hermoso muchos peces nadando alrededor del océano playa bonitos lotes de arena
82,asegúrese de mirar playa llamada barcos fuimos uno uno a hacer snorkel peces botes limpios intenté atrapar tortugas vistas los mejores días de nosotros asegúrese de mirar
83,"bahía varios centros turísticos, incluido el acceso a la playa de los sueños, muchos vendedores de playa, playa para caminar, gente que llega a la línea del centro turístico, playa, calle principal, zona de compras, restaurantes, otra hermosa área, caminar, disfrutar del paisaje, caminar, muchos taxis paran."
84,hermosas varias playas buen snorkel cuidado resaca área de playa nadar mucho más tranquilo
85,playas bahías zona hermosa uno diferente encontrar
86,"Realmente hermoso, buena natación aunque olas alrededor de niños geniales."
87,hermosas islas vista bahía hermosa noche hicimos recorrido ver bahías playas de arena blanca variedad ola ver tortugas otros vieron ballenas día grandes resorts área pequeña reserva playas naturales
88,nunca regresó a ningún lugar regresó el mejor momento
89,excelente dinero resort me alojé una semana linda playa excelente playa siempre encontré algo bueno excelente aunque uso la playa habitaciones limpias tranquilas personal amable definitivamente regresaré
90,áreas para nadar frente a la playa encantada nadar snorkel agua
91,"Me quedé en la bahía de los sueños, creo que caminó por la playa todos los días, varios hoteles, paseo público, frente al frente, alrededor del muelle, playa pequeña, arena gruesa, agua limpia y adecuada, puede que esté tranquilo, puede surfear tranquilo, ver peces alrededor de las rocas, muelle, también se ve el muelle, botes pequeños."
92,"una bahía, excelentes turistas, los lugareños obtienen suficiente área de la isla, hermosas playas de arena, un lugar perfecto para remar, marina, incluidas las ballenas, visita obligada"
93,playa hermosa seguro nadar un poquito hacer snorkel mucho ver final del día frente sueños resort pequeño pez alimentar también visto amor definitivamente regresar seguro hermoso
94,agua bastante tranquila arena fina todavía muy agradables largos paseos
95,Una bahías acceso a playa pública hotel turistas pequeños hoteles zona bonita roca
96,se quedó sueños bahía gran amado olas resaca
97,playas estupendo snorkel natación pesca profunda comida
98,playa limpia agua clara definitivamente lugar visita
99,bahía hermosa sol playa todas las mañanas excelente agua costa oeste a veces nada genial
100,agua de la bahía siempre lo suficientemente tranquila nadar remar muchos peces área pequeña
101,playa bonitas rocas alrededor hermosas olas obtener una playa grande buen surf obtener playas nadar excelente hacer snorkel olas agradables lado izquierdo tranquilo frente a la playa hotel generalmente pesca un poco de agua rocas tranquilas a la izquierda generalmente la gente local vende muchos botes a menudo lugar agradable
102,genial increíble snorkeling un relajante hermoso regreso
103,uno toma grupo barco grupo chicos ven la costa pescar poco ver nadar barco ver tortugas mucho mucho playa privada disfrutar del tiempo nadar como el tiempo ir restaurante de playa local tiempo de regreso atrapar atardecer hotel paseos playa de sueños
104,ubicado la mejor experiencia en el océano bahía olas nadando
105,Me encantó la mejor manera de ver el área que muchos eligen.
106,hermosa bahía nadar corrientes playa fuerte bastante empinada arena como
107,Conseguí un hotel bastante bueno. La ciudad parecía ser hoteles caros e inclusivos. Excelente. Recomiendo tomar un taxi para viajar a la playa.
108,"Pasé el día en la playa, grandes hoteles, encontré playas poco concurridas."
109,volver cerca de la estancia estancia por noche por día incluido el día del hotel
110,hotel parque hermosa bahía disfruté buceando bahía sierra peces agua áspera
111,bahía excelente mañana disfrutar gente diferente clima agua
112,isla hacer snorkel alrededor lotes ver playa lado largo playa inclusiva hoteles acceso a sueños restaurantes de playa comer almuerzo para llevar traer área de entrega acceso a playa pública próximo campo de golf área para caminar llegar a la playa
113,Realmente disfruté playa océano mucho más tranquilo visita océano cálido buena agua arena gruesa poco difícil caminata excelentes actividades acuáticas mucho snorkel hoteles en gran bahía
114,fantásticos restaurantes de playa bonito paseo alojarse en hoteles de ensueño
115,"Maravillosa semana, pasé un día, visité mucho la playa, pasé mucho tiempo mirando la bahía."
116,hotel justo en la bahía bastante hermoso muchos peces nadando alrededor del océano playa bonitos lotes de arena
117,asegúrese de mirar playa llamada barcos fuimos uno uno a hacer snorkel peces botes limpios intenté atrapar tortugas vistas los mejores días de nosotros asegúrese de mirar
118,"bahía varios centros turísticos, incluido el acceso a la playa de los sueños, muchos vendedores de playa, playa para caminar, gente que llega a la línea del centro turístico, playa, calle principal, zona de compras, restaurantes, otra hermosa área, caminar, disfrutar del paisaje, caminar, muchos taxis paran."
119,hermosas varias playas buen snorkel cuidado resaca área de playa nadar mucho más tranquilo
120,playas bahías zona hermosa uno diferente encontrar
121,"Realmente hermoso, buena natación aunque olas alrededor de niños geniales."
122,hermosas islas vista bahía hermosa noche hicimos recorrido ver bahías playas de arena blanca variedad ola ver tortugas otros vieron ballenas día grandes resorts área pequeña reserva playas naturales
123,nunca regresó a ningún lugar regresó el mejor momento
124,excelente dinero resort me alojé una semana linda playa excelente playa siempre encontré algo bueno excelente aunque uso la playa habitaciones limpias tranquilas personal amable definitivamente regresaré
125,áreas para nadar frente a la playa encantada nadar snorkel agua
126,"Me quedé en la bahía de los sueños, creo que caminó por la playa todos los días, varios hoteles, paseo público, frente al frente, alrededor del muelle, playa pequeña, arena gruesa, agua limpia y adecuada, puede que esté tranquilo, puede surfear tranquilo, ver peces alrededor de las rocas, muelle, también se ve el muelle, botes pequeños."
127,"una bahía, excelentes turistas, los lugareños obtienen suficiente área de la isla, hermosas playas de arena, un lugar perfecto para remar, marina, incluidas las ballenas, visita obligada"
128,playa hermosa seguro nadar un poquito hacer snorkel mucho ver final del día frente sueños resort pequeño pez alimentar también visto amor definitivamente regresar seguro hermoso
129,agua bastante tranquila arena fina todavía muy agradables largos paseos
130,Una bahías acceso a playa pública hotel turistas pequeños hoteles zona bonita roca
131,se quedó sueños bahía gran amado olas resaca
132,playas estupendo snorkel natación pesca profunda comida
133,playa limpia agua clara definitivamente lugar visita
134,bahía hermosa sol playa todas las mañanas excelente agua costa oeste a veces nada genial
135,agua de la bahía siempre lo suficientemente tranquila nadar remar muchos peces área pequeña
136,playa bonitas rocas alrededor hermosas olas obtener una playa grande buen surf obtener playas nadar excelente hacer snorkel olas agradables lado izquierdo tranquilo frente a la playa hotel generalmente pesca un poco de agua rocas tranquilas a la izquierda generalmente la gente local vende muchos botes a menudo lugar agradable
137,genial increíble snorkeling un relajante hermoso regreso
138,uno toma grupo barco grupo chicos ven la costa pescar poco ver nadar barco ver tortugas mucho mucho playa privada disfrutar del tiempo nadar como el tiempo ir restaurante de playa local tiempo de regreso atrapar atardecer hotel paseos playa de sueños
139,ubicado la mejor experiencia en el océano bahía olas nadando
140,Me encantó la mejor manera de ver el área que muchos eligen.
141,hermosa bahía nadar corrientes playa fuerte bastante empinada arena como
142,Conseguí un hotel bastante bueno. La ciudad parecía ser hoteles caros e inclusivos. Excelente. Recomiendo tomar un taxi para viajar a la playa.
143,"Pasé el día en la playa, grandes hoteles, encontré playas poco concurridas."
144,Excelente área fácil para bucear nadar en la playa fácil llegar excelente caminar por la arena
145,water ever gets deep little water calm bay see
146,"Área increíble, una de las mejores playas frente al mar, arena, agua clara, hermosa área de peces, snorkel, arena, tarde, temprano en la mañana."
147,bonita bahía buenos hoteles agua tibia peces ven a comer amor
148,hermosa zona alrededor del resort bahía océano perfecto para nadar agua tibia
149,hoteles principales lugar encantador relajante compras gran lugar como lugares gente amable
150,"Bonita playa para bucear, mucho mejor, peces grandes, ballenas."
