,comment
2782,intentando conseguir coche trabajo funcionando número de trabajo vendedores intentando vender algo playa preciosa buceando buena zona vendedores
2783,aguas tranquilas muchos lugares relajarse playa comida disponible mesas con sombra sitio de ciudad lejana ver a lo largo del camino
2784,playa hermosa ocupada gran lugar snorkel lugar para nadar sol leer gente vendiéndonos cosas habituales lugar de playa principalmente disfrutando hermoso paraíso natural arena suave cálida agua clara días perfectos
2785,entrega hermoso ir restaurante semana siempre super super lleno gente ciudad otros ciudad aléjate posible tiempo playa varias veces huatulco persona snorkeling
2786,segundo arrecife taxi del otro extremo taxis generalmente disponibles volver al final del día
2787,playa principal llena de gente nadé pequeña playa enfrente de la principal grandes lotes de coral muchos buenos peces vio buceo buen lugar pasar la tarde
2788,comida de piña agua increíble cristalina diferentes vendedores restaurantes increíbles
2789,disfruté viendo el arrecife contado poco amado
2790,Grandes arrecifes montones de peces coloridos diversión viendo buceo pescar alquiler de equipos baratos buena comida bebida a lo largo de la playa nada realmente
2791,lejos lugar favorito snorkel agarrar almuerzo huatulco fijar día ver cosas gratis pagar comprar almuerzo amor camino de camarones mesa sombra día quiero sol tomar sillas tiempo de playa camarero incluso configurarnos guía de snorkel trabajos nos tomó min trajo toque de pescado paloma nosotros cheque langosta nos mostró cueva nos pagó área de snorkel olas más grandes mucho más tranquilo gran lugar familias también playa gastar precios de taxi establecer tarifa de hotel taxi local casi más barato tomar taxi posible caminado colina uno muchos taxi hacer arreglos conductor regresar obtener precio pagar entrega taxi hacer camino de regreso resort entrega taxi más barato hotel taxi caro viaje en taxi huatulco completo sin viaje entrega disfrutar
2792,taxi resort pesos playa fui a bucear playa mucho lugareños fresco caluroso día de fin de semana equipo de alquiler disponible día no gente pequeños restaurantes sitio beber algo comer seguro salir pertenecer agua el personal podría irse de la mesa nos vería regresar haciendo snorkel en realidad personal mirando la mesa fantástico servicio recomendaría ir disfrutar del tiempo área local uno de los mejores obtener resort pasar el día lugareños
2793,Lo pasamos genial haciendo snorkel guiado las dos primeras veces varias comidas playa bordeada de parejas verdaderamente
2794,hicimos snorkel en diferentes áreas áreas de viaje accesible taxi entrega mejor coral vivo grande frente a la izquierda pequeña playa ver agua izquierda bastante clara tomada entrega restaurante taxista dueño nos consiguió equipo de snorkel a mitad de precio en cualquier otro lugar comida buena cobrada tarifa de sesión baño altamente restaurante de playa también bahía uno pequeño coral vivo más equipo de snorkel restaurante de pesos habitual estacionado comida comprada realmente quiero cobrarnos pesos paraguas cobrarnos estacionamiento recuerde nombre lugar lotes intermedios playa parque cosas necesita sombra pesos baño tomar bahía recorrido en bote nos llevó a la bahía siguiente hacer snorkel hacer snorkeling asegurarse de que el bote vaya despejado hermosa sierra tortugas viaje de regreso
2795,entrega playa realmente genial olas tranquilas perfecto niños pequeños sin embargo fueron botes llenos botes turísticos realmente nadan botes fueron a otra playa como otra cosa como cerca de la playa muy caro conseguí comer pescado muy caro
2796,fue entrega primer día huatulco bonita playa aguas tranquilas costa rocosa snorkel explorar día fue muchos huevos de medusa agua flotante haciendo experiencia huevos nosotros camino agua flotante nadar sin chocar muchos pueden valer la pena amable disfruté restaurante de mariscos decidió nadar huevos
2797,Playa llena de gente Coral muerto Buceo con snorkel Mesas con costo mínimo Paseo en bote turístico La playa recibe muchos visitantes
2798,hermosa playa varios árboles sombra mente grupos grandes otros buen snorkeling a lo largo de rocas izquierda botes dejar turistas grandes multitudes viene cada largo patatas fritas bolsas mesas
2799,nadar buena playa algo estrecha restaurantes ofrecen tumbonas probablemente volvería
2800,fantástico snorkeling muchos peces diferentes tipos hermosos colores coral bueno fue cueva agua clara muy recomendable
2801,me encanta la playa piña mariscos increíble hermoso lugar hacer snorkel
2802,"La segunda zona de playa favorita se llena mucho los fines de semana. Me encanta el restaurante. Primer restaurante. Playa. Bueno, otros. Buen snorkel. Por favor, ponte de pie en el arrecife."
2803,estupenda playa familias niños pequeños rocas traen buen snorkel buena comida me encantó
2804,preciosas vistas increíble agua cristalina hermosos peces olas increíble
2805,lugar genial snorkel muchos peces tortugas arrecife de coral poco lleno seguro equipo limpio vale la pena
2806,playa excelente snorkeling agua clara restaurantes tomar mesa almuerzo definitivamente sugiero venir a hacer el deseo del día
2807,bonitas olas pequeñas capaces de ver peces poco espacio nadar rocas de coral lejos
2808,"Gran pequeña playa, toneladas de snorkel, pequeños restaurantes, pasamos medio día. Me encantó cada minuto."
2809,Otro hermoso día Buceo en la playa Bahía tranquila Buena comida Día de diversión en la playa
2810,la mejor playa huatulco increíble color agua lindos restaurantes equipo de snorkel disponible alquiler
2811,hermosa playa snorkel traje equipo de snorkel oferta alquiler playa final también casilleros disponibles alquiler pesos playa tranquila y segura
2812,entrega excelentes restaurantes playa hacer snorkel increíble seguro comprobar apertura de la cueva estrecho fácil nadar corta distancia cueva pequeña disfrutar
2813,impresionante playa muchos bares restaurantes increíble snorkeling agua cristalina comprar algo bar en la playa sentarse beber día palapa
2814,excelente lugar snorkel bebida almuerzo aguas tranquilas agua clara cerca vienen todos los años
2815,buena playa pasar el día aguas tranquilas buen snorkel varios restaurantes elegir muchos peces ver corral
2816,dos veces pasada hermosa playa ok mucha gente mirando gente mirando la primera vez se cobró mesa extra comida bebidas la segunda vez restaurante diferente dijo cargo extra mesa agregada pesos mesa con sombrilla comida bebidas ordenadas bien volver los vendedores dan mala fama propina en general peso arrancado
2817,playa hay que ver bucear estupendas sillas alquiladas mesa sombrilla presión dio pesos vendedores de presión hay que ver seguro
2818,ir a entrar siempre ir a ver el restaurante de entrega tener buen cuidado cerveza comida fría buen nadar frente al restaurante quiero hacer snorkel ir a la esquina de la cueva necesito saber preguntarle a alguien punto hacer tour de snorkel gran día en la playa
2819,playa pública increíble servicio de restaurantes snorkel excelente agua azul claro comió comida de restaurante servicio increíble muy recomendable
2820,tiempos de nado mejor pez de coral visto área de huatulco visibilidad siempre buena se puede encontrar buen snorkeling
2821,"hermosa playa de arena, buena elección, restaurantes, grandes árboles de sombra y sentarse, excelente snorkeling, agua clara"
2822,"hermosa playa, el mejor snorkel de todos los tiempos, incluso cueva, saber encontrar restaurantes, saber nombrar uno, consiguió asiento temprano, uno primero, la playa parece presión, comprar cualquier cosa, tengo un par de cervezas, pensé que se escaparía, vendedores de la playa, horas agresivas, aunque evite a los chicos, consiga un vehículo, aunque lo deje en paz pronto, necesita servicios, menos equipo."
2823,"Tomé un taxi, hotel, excelente natación, aguas tranquilas, snorkel, muchos restaurantes, playa, asegúrese de traer una toalla, definitivamente recomendaría ir los fines de semana entre semana, lleno de gente, buena comida, restaurantes, pasar el día, recomendaría ir."
2824,Excelentes restaurantes en la playa. Buen snorkel. Recomendaría una semana de playa. Fines de semana muy ocupados.
2825,pasar a los chicos molestos que intentan llegar al restaurante hermosa experiencia de playa en el extremo izquierdo excelente snorkel nadar siguiendo el final de la roca otra pequeña playa a la vuelta de la esquina bastante restaurantes lugares alquilar equipo de snorkel necesita agua cálida calma
2826,elija las playas entrega un poco más grande hermosa arena suave muchos servicios de estacionamiento disponibles definitivamente vale la pena detenerse
2827,fuimos a hacer snorkel en la playa olas súper tranquilas pudimos ver diferentes tipos de peces coral guía nos llevó pequeños súper divertidos
2828,mejor snorkeling playa de arrecife de coral nadar tal vez yardas aguas cristalinas pies de arrecife arrecife profundo blanco ver nuevo en toda el área muchos peces mejor ir a la playa de la mañana multitudes mostrar aguas más cerca playa medio restaurantes playa también alquilar equipo de snorkel cerveza guacamole entrega excelente natación de la mañana
2829,hermosa playa aguas cristalinas olas hermoso lugar de snorkel tour el chico alquiló el equipo de snorkel nos llevó a hacer snorkel también alimentar a los peces en la cueva bucear peces fue una experiencia increíble
2830,Pasé la tarde disfruté mucho aguas tranquilas snorkel incluso personas nadadores alquilan equipo de snorkel disfrutan bebida comida restaurantes
2831,tomó taxi huatulco playa entrega snorkeling alquiler de casilleros en la playa del extremo opuesto precios de guía de snorkeling casilleros razonables playa como piscina agua ofertas de playa adecuadas comida bebidas música actividades acuáticas genial definitivamente regresaría
2832,Me encantó el lugar donde nadé en la cala. Pude ver el crucero. Excelente lugar. Colgar en la playa. Relajarse.
2833,gente intentando llegar restaurantes decidió quedarse playa del árbol increíble nadar perfecto limpio seguro lote de niños restaurantes por persona disfrutó mejor playa nadar con snorkel vi tortuga nadando
2834,Gran lugar para pasar el día en la playa Tomé un taxi en la ciudad Alquilé un bote de regreso Pasé el día en el restaurante Playa Pedir bebidas Día de refrigerio a un precio razonable Podría nadar hacer snorkel Caminar en la playa Increíble
2835,"playa divertida buenos vendedores de snorkel alimentan a los turistas un poco alquiler de chalecos salvavidas un poco caro, sin embargo, es muy divertido"
2836,paraíso seguro hermosa playa prístina chalecos salvavidas disponibles tomó taxi extremadamente razonable izquierda objetos de valor restaurante área de comida día
2837,elección de lugar sentarse restaurantes ofrecen gratis mesa sillas obtener factura cobrar comió bebió cobrarnos paraguas propina grande sentarse en otro lugar muchos lugares preguntar cargar bucear increíble comprobar cueva
2838,año encontrado precios playas altas servicio de la ciudad realmente restaurante de playa decir saber relajado mirar a su alrededor alguien cada vez buscado plato sucio comida nunca elegida varios empleados caminaron bahía obtener nombre restaurante
2839,increíble snorkel pequeña bahía muchos restaurantes minutos lado de la ciudad gran número de guías se acercan llegada pagando guía realmente loco mejor snorkel izquierda número de bahía gente ya agua
2840,Hice snorkel dos veces encontré mucha experiencia otros dijeron arrecife increíble muchos restaurantes de playa uso mental mesas snorkel compraría algo comer beber lugar pintoresco experiencia diferente viaje corto en taxi resort
2841,"Probablemente la mejor playa de Huatulco, nadar, hacer snorkel, sin embargo, los vendedores de restaurantes van bastante a la derecha de la playa, evitan tomar un taxi."
2842,hermosa playa cala protegida fue por primera vez restaurantes cinco años pared pared restaurantes un extremo playa área derecha botes tirar servicio de comida restaurante siempre desaparecido
2843,pasar el día surfear protegido siempre cálido almuerzo para llevar comer cualquiera de las dos excelentes opciones
2844,Ir a cerveza Vistas baratas Traer un taxi para quedarse durante el día
2845,bring umbrella plan buying something one many fun snorkling beginner taxi walked
2846,escaparse principalmente playas ir principalmente familias lugar de playa de vacaciones excelente comida precio justo excelente lugar bucear playa adecuada peso barato paseo en taxi fui días fila
2847,la familia tomó un corto viaje en taxi en la playa para bucear con esnórquel prueba restaurantes resort playa ubicada ensenada natural olas protegidas esnórquel en condiciones difíciles entrega perfecta se acercó recorrido local ofrecido guíanos primero el esnórquel nos llevó por el área nos mostró cosas excelentes comida sol playa aguas tranquilas excelente manera barata conseguir día de resort excelente momento
2848,entrega relajante playa agua clara y tranquila genial nadar snorkel grupo palapa restaurantes ofrecidos variedad mariscos lindo lugar llevar familia
2849,comida delicioso servicio ve a preguntar bien toalla de playa dejada atrás encontrada guardada devuelta un par de horas después
2850,playa larga pareja metros lleno océano como barcos turísticos traer grupos hacer snorkel ok mejor principiante sería bueno ver peces pequeño coral vivo restaurantes línea playa oferta sombra definitivamente hay que verlo
2851,suave playa pareja metros largos restaurantes ofrecen comida bebida sombra gente abarrotada como océano uno mejores lugares área de snorkel barcos para bucear traer gente bastante experimentada encontrar bucear ver peces un poco coral vivo agua tranquilo verdadero principiante llamaría bucear con snorkel bueno definitivamente hay que ver ubicación
2852,bonita playa agua clara snorkeling malos barcos mantenidos a un lado de la playa lejos los nadadores se ponen muy ocupados barcos traer tours muchos restaurantes elegir conseguir bonitos restaurantes llenos al lado agua hace
2853,visité la playa un par de veces a la semana agua cristalina buceando excelente manera pasar el tiempo saludado inmediatamente alguien tratando de sentarse en las mesas otro agregar cargo por servicio factura comentario negativo evitaría las mesas rojas blancas simplemente viajar taxista detener vista del faro
2854,mirar restaurante camarero primero en llegar sillas descansar camarero intentó factura quedó atrapado quería camino habló estacionamiento cosa camarero mal nombre paraíso huatulco liderar creer otros cuidado mantener
2855,aguas tranquilas y limpias nadar snorkel cerveza mirar ya que el restaurante comió cargo por servicio adicional
2856,Fui en taxi al hotel y pasé el día entero increíble increíble haciendo snorkel agua azul limpio toneladas restaurantes elige haz que te sientas en casa gente extremadamente amable seguro amado
2857,excelente lugar para ir día playa excelente snorkel peso taxi pesos resort uno dueños de restaurantes se reúnen guardar cosas restaurante playa alquiler de máscaras pesos pesos incluyendo aletas realmente necesito excelente comida bebida restaurantes dicen que la gente va bien
2858,playa fácil conseguir una maravillosa playa para hacer snorkel muchos lugares comer tiendas comprar niños bastante protegidos hacer mejor visitar la playa familias niños pequeños
2859,bonita y pequeña vista de la bahía hacer snorkel buena comida cosa limpia traer toallas sillas cualquier otra cosa
2860,encantadora playa de arena restaurantes bordeados tiendas de playa playa para bucear fácil seguro marea fuerte coral playa lejana pescado de sierra precios de restaurantes rumbo más alto área del puerto deportivo esperado buen día de playa
2861,Playa pública fines de semana concurridos fantásticos entre semana comida bebida precio razonable calidad
2862,Pasé la temporada de vacaciones increíblemente ocupado dijo que todavía disfruté de la playa nunca fui a bucear toneladas de personas se sentaron en el restaurante cervezas conseguir mesa silla paraguas
2863,playa carretera de fácil acceso barco se llena mejor momento para visitar primera mitad de la mañana visibilidad excelente snorkeling bueno se llena ruidoso
2864,Llegó temprano en la mañana Colocar sombrillas Sillas Playa ocupada Fui a hacer snorkel Regrese temprano Medusa Ver días Nuevas medusas Vienen muchos peces Ver Izquierda Temprano en la tarde Playa llena Agua Me encantó Recomendar ir Temporada de vacaciones Ayuda a menos que esté bien Grandes multitudes Fácil tomar un taxi
2865,uno ir playas entrega snorkel nadar flotar kayak soporte tabla bote de remos amar comida entrega restaurante sentarse relajarse comer beber buena comida
2866,gran playa buen snorkel llegar temprano los lugares se llenan especialmente los fines de semana servicio de comida bueno tomar un taxi recoger horas más tarde
2867,primera vez año último amado pequeño lugar pintoresco snorkel flotador agua restaurantes excelente buena comida geniales alquilados chaleco salvavidas tienda final snorkel tomó taxista nos llevó luz arriba primero excelentes vistas
2868,playa hermosa limpia calma perfecto los niños necesitan alquilar sombrilla sombra muchos restaurantes alquiler de comida local equipo de snorkel pesos día preguntar casillero precio incluido arrecife de coral agradable sierra muchos peces hija disfrutó mucho regresar hotel de playa preguntar parada de taxi mirador nada lugar ver tomar bahías impresionantes
2869,playa fácil volverse popular todo lo que quiera día de diversión playa alquiler de snorkel tienda alquiler de kayak excelentes restaurantes playa vendedores locales playa vendiendo de todo ostras frescas locales pesos de media concha tome un paseo en un gran bote banana disfrute del trabajo en la playa bebiendo uno frío
2870,gran lugar para practicar snorkel fabuloso arrecife abundancia diferentes peces ver ir temprano pasar el día mejor ir temprano se llena más tarde muchos lugares a lo largo de la playa sentarse comer beber también colocar alquilar equipo de snorkel
2871,"Intenté un viaje, encontré un lugar lleno de gente, mucha zona de playas, por lo general, obtengo playas, un aire muerto, hecho calor, terminó la hora de salida, fue en su lugar."
2872,fui por la tarde a la playa ocupada sin embargo mucha gente buceando gratamente sorprendida buen snorkeling se escapó a la orilla agua clara muchos peces más pequeños tal vez mucho tiempo bonito coral bonita playa lejos a lo largo de la orilla izquierda parada almuerzo restaurantes mesas libres a pesar de que la playa está ocupada muchos en su mayoría
2873,Quiero hacer snorkel. Gran lugar. Ir a buscar equipo. Tour por parte del área. Increíble.
2874,"Tomé un taxi, una hermosa playa, una mañana, casilleros, pagamos cosas con candado, buceamos, increíbles, bastante tiempo, practicamos snorkel, una pequeña playa, nos sentamos, observamos alrededor del mediodía, muchos barcos se llenaron bastante, muchos lugares pagan, traen, encuentran el baño, uno, los restaurantes usan un lugar increíble, lo recomiendo encarecidamente."
2875,lugar perfecto pasar el día playa natación perfecta sentarse día de playa comida bebidas traídas ostras frescas langosta pescado tacos vida
2876,detenido tour bahías decepcionado precios pagar uso sería precios tiempo muy playa demasiado ocupada plus
2877,playa frecuentada muchas veces siempre agua limpia tranquila snorkeling excelente día correcto muchas opciones para comer genial familia
2878,pasar tiempo hermosa playa almuerzo regresó resort excelente comida casera una de las mejores comidas huatulco papas fritas hechas a mano nachos tacos de pescado genial
2879,hermosa playa mucho tiempo de viaje lleno de gente tiene un pequeño y agradable lugar uno restaurantes bocadillos bebidas en general buen día
2880,snorkel en la playa del lado norte pequeña cueva alrededor del área rocosa lado norte otra pequeña playa escondida a la vuelta de la esquina
2881,pequeños contratan guía ponen a los niños vista transparente plato arrecife
2882,excelente snorkeling aguas tranquilas arrecifes de coral muchos peces equipo de snorkel precios razonables
2883,comida playa snorkel fantástico pequeño lleno de gente vale la pena hacer snorkel pasar todo el día
2884,gran lugar primero sacó curso todos contentos ver llegó buen momento nos mostró un primer restaurante línea servidor mantuvo comida bebida viniendo vi cosas fue paseo en bote excepto curso tomó jet chico increíble fue tiempo veces incluso años me encantó fue a pescar en bote pequeño recorrido vi tortuga océano bote azul afuera gente realmente genial nos cuidó volver las próximas vacaciones
2885,lugar fantástico para hacer snorkel por primera vez oportunidad de nadar tortugas también vimos muchos peces hermosos incluido el pez globo pez bueno agua limpia y clara hermoso arrecife de coral muy recomendado
2886,una hermosas playas agua prístina totalmente tranquila olas fuertes piscina natural por mucha sombra libre en cualquier lugar consumir algo uno restaurantes obtener sombra tenía un mes de antigüedad baño de fácil acceso agua limpia sombra un poco áspera mucho mejor niños
2887,playa tranquila snorkeling fabuloso especialmente equipo para principiantes alquiler disponible precios razonables varios restaurantes línea playa tomó taxi pesos conductor regresó recogernos tiempo taxis disponibles día necesita preocuparse precio del taxi tarifa tiempo de amor playa playa favorita hospedarse
2888,"todo el mundo recibe la ciudad trabaja pregunta al taxista llévanos bonita playa genial ir a comer alquilarnos equipo de snorkel, etc. en realidad como restaurante ir al final restaurante solo comer sin presión hacer snorkel"
2889,gran playa fácil entrar al agua fácil buena playa para bucear tranquila cálida muchas opciones comer buena comida
2890,playa entrega playa maravillosa toda la familia excelente comida aguas tranquilas olas increíble snorkeling incluso snorkel en cuevas
2891,entrega maravilloso restaurante ubicado nombre de la playa comida excelente personal amable sombrilla asientos playa derecha tenga mucho cuidado artículos personales bucear bahía gran lugar niños olas
2892,una de las mejores comidas comidas sentarse en la playa sillas de arena por supuesto probar camarones piña deliciosa
2893,ir a hacer snorkel guía en la playa del otro extremo bastante barato siempre ventaja tomada lugar ver muchos peces como nadar resaltar lejos peces azules largos a lo largo de la experiencia verdaderamente hacer que ver el azul sea muy real siguiente asunto vale la pena
2894,Fui dos veces una semana veces increíble preguntar por el mejor equipo hacer snorkel súper barato cabeza extremo izquierdo playa poner cosas casillero obtener cabeza arrecifes cuidado marea olas tirar acercarse rocas ir cueva bastante buena hora dos muchos lugares comer
2895,linda vista lugar casi gente turismo cuídate lugar vinieron todos dijeron lugar por favor evítelo a menos que le guste basura buena comida
2896,min taxi zona vacaciones hotel pesos tipo turístico restaurantes bares bonito entorno agua fácil nadar
2897,Fue un momento realmente agradable. La familia comió comida mediocre y cara. Daño en un plato pequeño. Mariscos mixtos.
2898,resguardado olas grandes bonito curso de agua clara sierra justa poca vida chiringuitos amable buen servicio precios justos
2899,disfruté de una playa de fácil acceso especialmente amigable también disfruté de una vida limpia
2900,excelente playa familiar aguas tranquilas oferta increíble snorkel equipo de snorkel alquiler bien paseos en banana boat paseos en bote para ver la bahía paseos en bote playa derecha final del día solicite un taxi en bote de regreso al hotel pesos por pareja bien vale la pena el viaje
2901,"Área de playas lejos, muchos lugareños, los turistas pueden caminar, agua, comida muy buena, muy razonable, excelente manera de pasar el último día. Seguro que regresaré un poco ocupado."
2902,fui a bucear vi muchos peces nadando genial conseguí una bonita mesa sombrillas uno primero restaurantes playa bonita playa de arena mucho espacio nadar fácil tomar taxi ir volver pesos también tengo poco dos vista hermosa volver ver atardecer faro
2903,playa entrega increíblemente hermosa snorkeling mejor ambiente experimentado genial definitivamente recomiendo a la gente que vaya
2904,pasar el día la semana pasada servicio comida increíble también razonable
2905,playa bueno bucear nadar agua calma claro agradable restaurantes relajado oferta excelente comida bebida servicio alquilar equipo de snorkel paseo en taxi camino accidentado dos amigos pagaron pesos ida y vuelta gente viene bote
2906,playa entrega excelente lugar para bucear cueva submarina genial instalaciones de restaurante fáciles agradable también
2907,Las playas a un corto trayecto definitivamente llamarían la mejor ubicación para bucear. Se llena los fines de semana. Muchas habitaciones por semana. Varias opciones. Restaurantes. Deje las cosas. Disfrute de la playa. Evite cobrarnos. Otra pareja habló. Lugar. Sucedió dos.
2908,"El mejor lugar para comer, beber, hacer snorkel, tomar el sol, el restaurante se encarga completamente del snorkel. El chico que practica snorkel viene alquila vendedores de equipos. Ven a compartir la experiencia. Maravilloso, segunda vez que lo visito, hace snorkel. Bueno, muchos peces coloridos."
2909,lindo día amigos lugar gente llena agua limpia como todo cerca comida bebidas tiendas
2910,snorkeling sierra peces mucha variedad descanso pequeña playa tiendas de buceo pequeños restaurantes aunque horas de diversión
