,comment
1191,segunda vez me gusta mucho el área regresar siguiente número almuerzo palapas encontradas mejor hay que comer camino a la derecha agua camino del extremo izquierdo lo mejor es visitar toda el área de playa vale la pena viajar restaurante almuerzo
1192,siempre voy a la bahía visitada hermosa playa comida increíblemente deliciosa un lugar para caminar en la playa
1193,"Visité la playa, autobús, taxi, costo, realmente disfruté de la playa, comida encantadora, uno de los restaurantes pequeños, también fui a bucear, bahías, crucero, vi muchos peces, lo recomendaría."
1194,instalaciones de playas uno parece encantador fácil nadar muchos restaurantes de palapa eligen nadar snorkel playa hermosa
1195,playa área de estadía del último día mejor snorkeling toda el área vale la pena taxi conseguir un día completo lotes de playa palapas de playa conseguir bebidas para el almuerzo la próxima vez ir primero
1196,viaje siempre hermoso buenos precios de snorkel el almuerzo sigue siendo bueno
1197,una hermosa bahía jamás vista taxi contratado un día que vale la pena conducir una hora haciendo snorkel paraíso como nadar chiringuitos de playa deje usar la playa varios recorridos van bien tome un taxi pregunte una autopista podría llegar
1198,corales llenos de gente nadando
1199,hermosos peces coloridos coral gran snorkel fuimos tour primera parada favorita
1200,la mejor experiencia de snorkel día ocupado hermosos arrecifes playa submarina encuentre muchos restaurantes maravillosos
1201,"Las mejores playas para bucear, mucha comida, restaurantes, playa, lugar especial."
1202,aguas tranquilas poco profundas muchos peces bonitos muchos peces realmente buscado almuerzo restaurante comida ir mejor ir quiero comida
1203,hermosa playa tranquila gente alrededor llena de gente caminar nadar restaurantes sillas de playa usar sat playa un par de horas mirando disfrutar del sol
1204,vale la pena playa favorita restaurantes locales ofrecen sillas de playa
1205,vino viaje en barco recorrido en barco privado parado snorkel agua agradable cálido snorkel increíble área agua calma días despejados grandes lotes ver calma genial nadar bien muchos restaurantes lugares comer atrapado mañana barco trajo uno restaurantes arroz a la parrilla lugareños playa caminando tratando de vender fresco aunque decir agua correcta como un hermoso lugar
1206,Me encantó la bahía Tomé un taxi Ciudad Colgó el día Regreso Pesos Nunca he visto un enorme banco de peces nadando Bien Nosotros Tenemos la bahía Buena idea alrededor de grandes barcos turísticos
1207,agua vista zona aguas tranquilas definitivamente ocupada realmente
1208,"Siempre vaya a la playa un par de veces quédese hermoso, excelente snorkel, punto maravilloso al que se accede, taxis en barco, viaje en autobús, gire en taxi, tome el camino a la playa, muchos restaurantes excelentes, elija"
1209,fui a la playa paseo de un minuto taxi playa agradable arena suave mucho tiempo restaurantes sentarse disfrutar de una bebida fría camarones frescos hacer snorkel buen coral cerca de la orilla necesito seguro ir poco de marea áreas poco profundas para nadar
1210,Pasé el día disfrutando haciendo snorkel decente pez globo hacer bastante camino de arrecife bastante largo y difícil recomendar que los niños consigan el auto pasó el día en el restaurante bebidas decentes asegúrese de pedir menú consultar precios nosotros cerveza bien pesos menú de pescado menú de comida pesos buscados pagado cantidad total se fue tomar taxi haría el viaje pesos almuerzo en la playa dos restaurantes bebidas en la ciudad dos pesos de dos días buena playa hermosa arena bucear buena parte pagar taxi estancia de un día
1211,manejó en auto un minuto en automóvil gire en la carretera principal hacia un camino de tierra lleno de baches lento también puede acercarse girar a la izquierda derecha derecha mejor bucear con snorkel muchos restaurantes diferentes lugar para estacionar elija un lugar para quedarse en el parque comer divertido podría estacionarse lugar excelente comida bebidas frías precios caro lote de la ciudad como bote bucear con snorkel mirar a la derecha gran día playa
1212,día nadando pies nosotros bancos de peces diferentes peces a nuestro alrededor bajo el agua
1213,viaje en barco también acceso por carretera mucho para comer como agua clara coral enorme peces enormes definitivamente vale la pena de un modo a otro
1214,"También tome un bote para recorrer el servicio, la comida es realmente buena, la gente amable definitivamente regresaría."
1215,lote de playa lugares comer amado playa comió lugar buena comida barato tomar tomar usar pesos tomar mucho buena comida lugar variedad bebidas snorkel barato equipo alquilado lugar snorkeling increíble comprar trajeron snorkel pagado nunca obtuve comprar contar ir grande gran experiencia
1216,conductor llévanos camino de tierra lleno de baches condujo lento tomó hermoso océano poco difícil día nadó almuerzo comida playa casi tiempo
1217,playa concurrida turista pintoresco pesca maravillosos restaurantes pescados mariscos gente amigable hermosa playa excelentes lugares snorkel precios
1218,segundo viaje coral aunque años mucho arrecife ver vida maravillosa seguro intentar ir con marea alta obtener una mejor experiencia conseguir coral seguro ir comida maravillosa tomar taxi pesos solo ida equipo de snorkel
1219,relajante hermosa bahía gran camino para hacer snorkel poco accidentado hermoso lote pequeños restaurantes
1220,Tomé un taxi lo último en un camino de tierra en un lado accidentado. La próxima vez viajaría en barco. Fui prácticamente a hacer snorkel. Bien. Buen último viaje. Agua. Poco vale la pena visitar.
1221,hermosa playa diversión tiempo en familia amigable distancia a pie fácil acceso alquilar surf derecho playa amigable para niños consiguió buena buena playa vio mejor viaje en barco mira bote pregunta vio toneladas recorrido de pescado increíble experimentado principal conocer buenos lugares buenos restaurantes manejar mañana vendiendo fruta fresca camarones realmente buenos fácil acceso condujo por carretera conductor experimentado peligroso conducir autopista pueblo pacífico lugar perfecto
1222,viaje de snorkel reservado playa desde gran viaje conocer guía agua poco mucho coral ver cantidad peces vistos guía de área de playas nos quieren bucear áreas cercanas área de peces alrededor interesante ver desde pequeña piña ver local vivir agradable almuerzo lado del océano tranquilo relajante
1223,"Fui a la playa, parte del recorrido, una hora, mucho tiempo, cerveza, nadar, excelente snorkel."
1224,alrededor pregunte encontrar mejor elección excursión en barco mejor precio tomar taxi también hacer snorkel en otra bahía playa increíble grande duro como tomar un día en la playa
1225,playa hermoso taxi nos llevó uno restaurantes caminó hacia la derecha playa caminó camino hacia la izquierda restaurantes de arena lugar último lugar a la izquierda permítanos usar una sillas palapas ordenar bebidas aguas
1226,playa todo lo que quiero experiencia en la playa precio paraíso real muchos turistas vienen a visitar la playa local bebidas de mariscos increíbles locales
1227,Hicimos una excursión al arrecife increíble playa concurrida deseo tiempo área definitivamente regresar
1228,"hacer snorkel en pequeños restaurantes increíbles comida increíble, asegúrese de llevar un viaje bajo el agua que valga la pena"
1229,condujo lugar consiguió mesa pasó el día haciendo snorkel comiendo tomando restaurante se sentó vino a vendernos cosas pagó pesos grande amó mejor
1230,playa increíble buena mesa de snorkel comida buena mejor
1231,Fui dos veces visita tour en bote segundo taxi paseo en bote bonito arrecife diferente orilla agua día bastante tranquilo vi toneladas vida de peces la segunda vez fui fui en taxi cerca del aeropuerto tomar camino de tierra lento viaje difícil agua difícil día elegido lugar para bucear playa hermoso ocupado momentos de relax comió restaurante muy buen servicio de comida playa definitivamente una de las playas favoritas
1232,camino que viene todavía camino accidentado vale totalmente la pena fruta oferta deliciosa fruta hermosa playa arrecife de coral peces corto nado orilla muchas palapa comida bebida tiempos lleno mucha gente caminar apuntar pasado mirar bahía oeste vistas tomar taxi ciudad podría costar pesos
1233,visitamos la experiencia del recorrido por la bahía de la playa almorzamos una playa barato viaje bastante largo agua vale la pena bueno llegar temprano gran recorrido llegan los barcos
1234,camino de tierra transitado obtener increíbles restaurantes en la playa palapa hacer snorkel lo mejor segundo mejor muchas personas toman un taxi traer esperar incluso quedarse horas preguntar precio se busca pesos regresar toma minutos debe ver especialmente snorkel
1235,playa aislada maravilloso arrecife restaurantes para bucear con snorkel playa derecha disfrutar de la vista disfrutando de la comida
1236,tomó un taxi alquiler de playa bote llévenos a bucear arrecife de coral viene bien playa alquilar equipo de bucear pesos día elegir restaurante comer beber pasar la tarde buceando comida amigable buena cantidad gente de coral poca profundidad muchos barcos fueron una vez todavía bastante bueno pez ver sierra pareja pez globo bastante poco profundo creo que quería bucear puede buen lugar barcos realmente mucho bucear con snorkel lado oeste recomendaría el área querer
1237,parte del recorrido se detuvo en la playa nadar almuerzo playa agua arena excelente snorkel en la orilla derecha almuerzo fresco excelente precio definitivamente regresar quédate la próxima vez
1238,difícil elegir una playa otra pasar el día gran playa llegó en barco hotel día perfecto comer mucho comprar snorkeling imprescindible
1239,Disfruté del almuerzo arena de la playa agradable snorkel playa agua clara pez sierra
1240,camino playa principalmente camino de tierra camino ir muchos restaurantes elegir sentarse beber comer tomar sol agua áreas de lotes de rocas coral de roca pareja de pies mejor bucear con snorkel derecho la roca viene pies de agua sierra familia toneladas peces coral recomendaría especialmente bucear con snorkel
1241,playa de regreso de pesos playa vale la pena cada viaje a través de minutos de taxi aeropuerto autopista camino de playa pareja pueblos pequeños local gran playa muchos restos de playa aunque un poco de comida excelente excelente snorkel alquiler de playa número de equipo de snorkel vendedores caminar disfrutar de agua clara barco también fue parte del barco privado altamente recomiendo dejar viajar en taxi asegúrese de que el taxi excelentes bebidas frías disfrute del día completo
1242,buen snorkel excelente comida playa taxi de regreso nos costaría bien la pena
1243,años hacer snorkel bueno como nadar hermoso pescado almuerzo una palapas bien tomado pescado de piña vendedores de camarones venta viaje en bote nos llevó más allá de las bahías día del parque disfrutamos
1244,"Manejé un viaje de un día Manejé a los vendedores tratando de tirar lugares de estacionamiento comer Seguí manejando Extremo de la playa Izquierda hacia la principal a lo largo de la playa Realmente me encantó la playa del otro extremo Uno alrededor Caminé Parte de la playa Restaurantes Área de botes Restaurante tratando de restaurante Barco decir bucear bastante fantástico Arrecife grande tomando bote Playa Acceso para botes Playa tiene chico Playa Llévanos saber muy lejos Playa Mucho pesos Dos nosotros Playa cerca Buceo decente Bonita playa se quedó probablemente al final de la hora Definitivamente vale la pena Pesos Bueno, la mitad de la playa se quedaría"
1245,la mejor bahía enorme arrecife de coral excelente snorkel mucho playa palapa restaurantes excelente excursión de un día desde que estuve fuera local también buen viaje
1246,visitado recorrido por la playa horas de recorrido conduciendo pequeñas vistas playa de piña agua snorkel alrededor de coral hermosa escuela
1247,simplemente pareja restaurante nosotros lugareños amigable tranquilo playa impresionante snorkel pasado playas favoritas
1248,gente vende disfrutar comida vistas increíbles nadar hacer snorkel
1249,parte visitada tour privado de snorkel me encanta el snorkel fantástico gran arrecife tranquilo vale la pena el viaje
1250,"Una de las mejores playas, también come bien, también alquila un barco, visita las playas."
1251,encontrar un lugar restaurantes en la playa uno hermoso ir comprobar viene tirar ir asegurarse taxi camino largo y arenoso
1252,hermosa playa hacer snorkel fácil acceso me encantó increíble genial como nosotros encantador comer muchas sillas de playa hamacas quedarse en la playa camino a la izquierda llegar al lugar final cerveza camarones fríos
1253,Definitivamente vale la pena el viaje. Obtenga agua enorme y clara. Excelente para practicar snorkel. Playa tranquila. También hay excelentes mariscos locales disponibles. Me encantó.
1254,gran manera de hacer snorkel lugar perfecto
1255,gran lugar hacer snorkel diferentes playas hacer snorkel un poco seguro conducir incluso experiencia de manejo autopista minutos camino de tierra taxis conduciendo gente tomar giro local autopista tomar taxi playa comida increíble pequeños restaurantes de playa probar pescado fresco
1256,lugar que debe ver área vino recorrido en bote bahías recomiendo hacer viaje hacer snorkel excelente playa derecha pez arrecife disfruté pez globo muchas agua maravillosa cálida tiempo fácil coral aguas tranquilas bahía muchos lugares sentarse beber comida izquierda bote muchos disfrutando bebidas frías dijo comida bueno día de la semana ocupado buen momento ir
1257,lugar muy como realmente pasar una tarde decente uno muchos muchos muchos restaurantes correcto arrecife de coral me encanta obtener agua ver peces de arrecife a la izquierda quiero ver mucho mejor hacer snorkel tomar uno botes haciendo que el arrecife sea enorme dar comida restaurantes excelente
1258,alojarse pesos taxi llévanos espéranos snorkel almuerzo nosotros hotel también viaje en barco conducir bastante interesante bastante ocupado especialmente snorkel lugares de arrecifes agua poco
1259,"Traiga arena, camine, excelente equipo de snorkel, playa disponible, primer lugar usado, claro, use, vea peces, corales, muchos lugareños, la playa se llena por la tarde, excelente lugar, coma fresco, pescado, playa adecuada, traiga a los pequeños, disfrute."
1260,"Pasé todo el día en la playa, uno consigue un auto, gira un par de millas, conduce al aeropuerto, minutos, se hospeda en la playa, se hospeda en un restaurante, ofrece sillas de playa, palapas, ofrece un excelente servicio, playa, lindas, excelentes vistas de la bahía."
1261,fuimos en bote a pescar nosotros ir día pasado día hora viaje en auto primero buenos caminos media hora caminos de tierra yendo pareja pequeños pueblos pueblo de pescadores playa hermosa bahía restaurantes snorkel coral playa derecha buena playa visto tres diferentes
1262,toma minutos conducir parte conducir a lo largo de camino de tierra excelente fruta mirar pareja vivir grande llegar playa encontrar muchos restaurantes palapa playa elegir conjunto obtener estacionamiento eligió un pedido beber agua agradable bucear parece arrecife nadar fácil ver muchos peces un punto escuela poder ver arrecife excelente snorkel disfrutar delicioso almuerzo de mariscos el mejor restaurante de todos
1263,aguas claras y tranquilas bahía excelente para hacer snorkel muy fácil de llegar
1264,Gran lugar para pasar el día. Pequeños restaurantes agradables en la playa. Una experiencia maravillosa.
1265,snorkeling realmente excelente guía nos llevó alrededor de rocas vimos muchos peces interesantes agua cálida olas agradables áreas claras el coral podía disfrutar de una vista increíble
1266,pequeña y bonita playa gran visita larga bahías comida vale la pena esperar calma
1267,buenos restaurantes colgar día precio almuerzo bebidas dejar cosas caminar larga playa nadar
1268,excelentes pueblos de playa palapa restaurantes elegir comer restaurante uso día alquiler mesa pesos área snorkel barcos snorkel mejor área encontrada área ocupada tiempo tranquilo relajante
1269,fui a la bahía recorrido vino a la playa parte del recorrido vendedores de lotes gran área de playa regresar definitivamente visitar la playa
1270,lugar de amor snorkeling playa sierra hermoso pez pez hermoso
1271,menos agua caliente olas hermosa excursión de un día agua necesita comida gente bastante buena paseo por la playa
1272,quiero viaje playa real chiringuitos de playa poco golpeado tomar taxi tarde alquilar snorkel alrededor del arrecife frente derecho precios decentes cerveza comida todavía se encuentran precios comida alta aventura conseguir viaje en auto aunque pueblo local vista realmente genial océano pueblo de playa lugareños verificar conjunto de ida
1273,almuerzo gran libro viaje experiencia completa agua jamás vista
1274,uno ofreció recorrido por la bahía excursión nosotros restaurante dejó cosas agua bahía claro pez nadó minutos obteniendo agua fue restaurante pesos pareja largo sentado playa haciendo difícil disfrutar pintoresco pequeño pueblo restaurante probablemente uno visto lejos experiencia genial dicho local ver tiempo también verificar área de pareja
1275,lugares para hacer snorkel agua se podía ver arena restaurantes
1276,parte detenida tour privado por el océano gran pequeña parada para pescar
1277,fantástica playa tranquila prueba el tour de snorkel pequeños lotes increíbles hermosos peces
1278,snorkel se detuvo para almorzar mucha comida excelentes vistas muchos vendedores de playa muchos vienen bien restaurante
1279,"Me encantó el agua clara, el almuerzo, muchos restaurantes de playa fueron bahías, nosotros, un gran recorrido."
1280,hermosa playa excelente snorkel visita la bahía recorrido en bote revisa los restaurantes aunque la playa
1281,participó excursión crucero otro crucero nosotros playa recorrido en barco bahías excursión guíanos paseo de regreso playa fácil alargarse lleno de baches camino de tierra experiencia muchos restaurantes arena palapas sentarse playa agua amado
1282,playa preciosa bucear mejor siempre conducir millas caminos sucios y polvorientos tomar un taxi acuático ir
1283,limpiar agua clara muchos restaurantes playa buena comida cerveza fría vistas agua clara pasado aeropuerto ver girar millas camino de tierra áspero valor
1284,fue hermoso día contrató un taxi pesos día nos recogió nos esperó bien visto se detuvo déjanos tomar playa simplemente increíble bahía hermosa snorkeling excelente agua cálida curso intentando vender tomar restaurantes mira mariscos frescos excelente pago lote área de almuerzo mariscos frescos día perfecto taxi
1285,realmente hermosa gran bahía bahías visitadas crucero encontrado precios de almuerzo altos precios locales de camarones área alta podría comer mejor en la ciudad disfrutar de tiempo extra nadar snorkel vendedores vender tomado suficiente
1286,playa fantástico hacer snorkel nadar coger taxi barco hermoso lugar alrededor ver el día ir
1287,hermoso decir que debe ir ojalá pudiera quedarse haciendo snorkel comida fantástica genial
1288,fantástico vi mucho pescado incluso muchos restaurantes crucero por la playa ir días comida de crucero principalmente mariscos manera parte experiencia niños pequeños intentan vender todo elegido playa decir salir
1289,una bahía agua tranquila playa de arena hacer snorkel excelentes lotes a lo largo de la playa pareja excelente pasar un día que vale la pena ir
1290,"gran experiencia yendo a pescar por la mañana, sería increíble, restaurante para nosotros, uno completo, bueno, decimos pescado frío cocido, pareja diferente, pareja increíble, pareja disfrutó viendo a muchos lugareños, barcos de pesca que vienen, equipo de snorkel, nadamos en aguas cálidas y tranquilas, muchos peces diferentes, gran día."
1291,playa barcos yendo gente nadando agua limpio
1292,hermoso lugar apartado vistas poco acceso difícil vale la pena el viaje
1293,playa algo nadar muchos restaurantes playa camarones increíble
1294,minutos después del aeropuerto otro camino de tierra que vale la pena el viaje muchas palapas pequeños restaurantes gente comida de palapas fresca bien preparada fue a la izquierda restaurantes de agua restaurante sillas largas bastante grandes dos niños bucearon alrededor de la pequeña orilla vieron muchos peces comida bebidas precios
1295,fui a la playa dos veces genial tomé un taxi regreso una hora de viaje costo de la ciudad viaje conductor de taxi incluso nos esperó la primera vez primer viaje colgado restaurante camino correcto segundo viaje se quedó en el restaurante días izquierdos buceó nadando comió buenos precios de mariscos restaurantes altos quedarse el día mantener las cosas buceando mucho ver todavía divertido alquilar equipo de snorkel vida dos lugares vista excelente palapa limpia grande sentirse como muchos alrededor muchos botes yendo Me sentí como mirar barcos bucear mirar nunca me sentí maravillosa playa muy recomendable
1296,playa que vale la pena distancia adicional hermosa bahía bastante palapas restaurantes comida divertida observar a la gente mucha gente buen snorkeling derecho playa larga podría pasar el día ir
1297,bonito lugar nadar olas poco tiempo nadar hotel sigue siendo un gran lugar caminar en familia incluso mirándonos se sintió seguro
1298,el mejor realmente mucho poco difícil dura mucho
1299,beautiful place swim dirty restaurants beautiful
1300,comida buenos lugares caros playa corta roca de coral cerca
1301,ciudad costera uno de los mejores lugares zona de snorkel buenos restaurantes de playa elegir gente amable viajar barco coche
1302,playa poco difícil conseguir tranquilidad hermosa playa buena natación snorkel restaurantes a lo largo de la playa gente playa llena especialmente marea alta
1303,Creo que es la mejor zona de playa para practicar snorkel alrededor del área de rocas. Lotes de playa. Los restaurantes también ofrecen uso de hamacas.
1304,obtener el día del alquiler nos recogió condujo hermoso lugar pasar el día también tomar el autobús local tomar la autopista taxi playa asegúrese de informarle al taxista la hora volver recoger ir ir restaurante frente a la playa excelente nadar bucear comida también bonito restaurante cerveza siempre fría preguntar disfrutar día conductor nosotros alrededor regresar ciudad gran día pasar disfrutar
1305,nadar mejor aún mirar olas altas amado playa de arena
1306,Bien vale la pena km de viaje camino de tierra playas de la izquierda derecha playa de comida poco profunda buen lugar
1307,playa hermosa playa jamás vista paseo poco largo minutos llenos de baches taxi mucho vale la pena final también comí camarones excelente incluso hamacas
1308,lejos mejor playa bucear olas áspero encontrar hermoso pez sierra pez globo pareja bueno traer equipo de snorkel playa larga muchos restaurantes nada disfrutado playa
1309,"Visité la playa dos veces agua de la carretera agua mejor espectáculo itinerante snorkel en el agua mejores bahías almuerzo restaurante bueno, mejor snorkel alrededor de las rocas surf en la playa buenos niños"
1310,hermoso pez de arrecife de agua gran viaje recomendado
1311,bote alquilado visitó área de bahías experiencia increíble vio pozo increíble
1312,gran lugar visitar la familia fue dos veces coche camino tierra millas genial varios lugares parar en el camino playa lote grande restaurantes playa elegir gente venir barco llenarse de gente
1313,estupenda playa muchos lugares lugares para comer cobrar servicio decir ver
1314,"bonita playa, varios buenos restos, incluso un viaje pequeño y limpio, lugar encontrado, hotel buscado, por supuesto, vaya, asegúrese de detenerse, camino de la fruta, diga"
1315,el mejor almuerzo en la playa comida buena hermosa playa gran servicio volver a continuación
1316,vengan todos gente linda excelente comida muy recomendable
1317,primera experiencia en la playa último día surf sol cerveza barata comer rudo
1318,natación segura mejor snorkeling buena comida playa también muchas palapas nadar ir de excursión los barcos llegan disfrutar de una playa tranquila
1319,hermosa playa hermosa agua clara hacer snorkel en la playa correcta el coral casi llega a la playa muchos restaurantes recomiendan ir en bote por la carretera genial
1320,el mejor lugar muchos peces de arrecife vivos amor arrecife arrecife sentarse playa como pacífico hermoso
1321,hicimos un recorrido en bote por las playas primera agua coral claro increíble la mejor parte ver grandes cardúmenes de peces el coral debe tener una excelente agua submarina nosotros nadamos con snorkel gran arrecife ver como un excelente snorkel
1322,playa última bahía playa traída por primera vez ver el océano maravilloso sentí como nadar
1323,recorrido detenido viaje de snorkel en la bahía como buen snorkel en la playa derecha practicó snorkel en otro camino de la bahía almuerzo en la playa caminando pueblo como turista de pueblo muchos lugares comen mucho lugar elegido come muchos recogen pescado fresco cocido playa caminada en un extremo pequeña bahía del pueblo definitivamente vale la pena ver el área la próxima vez que se quede puede hacer snorkel en el arrecife
1324,hermoso lugar buenos restaurantes bien bien
1325,"Llegué a la playa en bote, recorridos por una bahía, linda playa, playa larga, muchos restaurantes junto a la playa, dieron un largo y agradable paseo hasta el final, disfruté del surf, también caminé por la playa del pueblo, verifique las cosas, piense en el área de una playa, vea muchos horarios de parada de barcos, también taxi, muchas personas vienen el día."
