,comment
2034,recorrido de snorkel a través del resort disfruté del día grupo grande cosas perfectas tomando mucho tiempo prepárese para bucear al aire libre asiento de vehículo algo feliz especialmente a nuestro alrededor un vehículo grande casi lateral que viene en dirección opuesta hacia nosotros tomando la carretera girar buceando público grande mucha playa ocupada restaurantes otros que quieren vender cosas playa también equipo local popular buena área artículos de bloqueo guía de agua área de arrecife redonda agua de peces local buenos minutos vi bastantes peces tristes sin embargo arrecife alrededor guía buen grupo usando agua de sol
2035,"Un poco de playa escondida, fácil de encontrar, vale la pena, hice snorkel, agua cálida y clara, vi muchos peces."
2036,excelente snorkeling linda playa muchos restaurantes restaurante favorito entrega estadía mesa sillas todo el tiempo usando agua comprar bebidas comida
2037,"asegúrese de revisar la cueva más allá del punto izquierdo, la siguiente playa, nadar alrededor de coloridos corales, encontrar"
2038,disfruté coco guacamole natural sombrillas playa playa fácil llegar maravilloso hacer snorkel en la orilla derecha
2039,regresé entrega menú de cerveza factura de pesos vino cargado pesos el camarero rápidamente dijo cuidado mantenga un registro ordenado también verifique la factura intente algo sucedió entrega
2040,playa entrega hermosa playa pequeña pequeños restaurantes buenos buen snorkel hermosa playa
2041,muy lleno muchos vendedores devuelven dólares
2042,tomó un taxi en la bahía restaurantes línea toda la bahía beber comer bien alquilar equipo de snorkel relajarse en la bahía buena natación sería perfecto para bucear en la bahía lateral a lo largo de rocoso tomar un taxi barco puerto deportivo bahía más concurrida completa agradable excursión de medio día
2043,"Lugar decente, vendedores, ir a restaurantes, seguir adelante, aventurarse, caminos de derecha a izquierda, se molesta mucho."
2044,Caminamos por el hotel Playa Entergra una mañana nos tomó una hora agradable caminata mucha sombra a lo largo de la calle lateral muchos pequeños alrededor también muchos dueños de bares alrededor llegar a la playa poco molesto hacer lugar para vivir salir temprano encontrar un pequeño bar en el borde del árbol la gente nos puso mesa sillas nos trajeron cerveza fría vida buena disfruté usar el baño poco snorkeling plato grande arrecife lado izquierdo área de playa bote con cuerdas perder mucho ver pronto entrar al agua ir a pescar camarones bucear mala excelente cerveza todavía fría buena muchos taxis esperando viaje de regreso pesos otro día increíble paraíso
2045,muchas veces desde entonces pienso bastante diferente nuevo huatulco puede ayudar realmente buen lugar quedarse un par de horas bucear playa pública dueños de restaurante servicio chicos alquilar lugar cosas colocar cerveza comida barato caro traer lugar barato verificar factura probar algo más ordenar incluir propina traer auto intentar llegar temprano estacionamiento empacado tomar objetos de valor caja fuerte sierra corriendo dama cámara probar alquilar máscara de snorkel tableros alrededor entrega conductor taxi cobrar de una manera todavía pez bucear metros de distancia tipo de cambio bastante mal intentar ir primero obtener en su lugar pagar perdido cada fin de semana lleno gente grande gente promedio gente de la playa en su mayoría turismo realmente dueños de restaurantes locales intentar mantenerse limpio poco sucio buen punto quiero ir a intentar tomar sol lugar de día tranquilo dueños de restaurantes comprar muchas cosas alquilar chicos salir de otro lugar consciente plátano de lo contrario los chicos intentan cargar mucho en lugar de correr andar cerca a veces peor gente segura comprobar devolución de dinero pagar hacer malo siempre lo siento ver usado buen lugar casi lleno bastante gente tratando de vender algo más tarde temprano ok
2046,hermosa bahía snorkeling natación cuidado camareros cargo de playa
2047,minutos huatulco taxi hotel taxi de vuelta nos costó pesos seguro podría caminar calle encontrado mejor oferta dejar cosas uno restaurantes área pública sombrillas de playa cosas dejadas incluso cosas de la cámara comer comida bueno caro pueblo playa excelente nadar temporada baja todavía ocupado tarde llegó temprano lugar par de horas mañana a los niños les encantó nadar primera vez océano toneladas pescado cerca de la orilla sierra mejor un poco más lejos orilla señorita esquina izquierda gran lugar pasar el día realmente nadar playas huatulco
2048,menos turistas lugareños mejor snorkeling playa favorita
2049,"gran playa bucear nadar tenga cuidado con los vendedores que intentan comer, vengan a las mesas, incluso digan que muchas veces siguen regresando, disfrutaron de los vendedores de la playa, molestos"
2050,quiero trato olas traer niños se ponen duros vender llegar playa generalmente llena hacer snorkel nadar lado izquierdo cara océano generalmente se ven muchos peces es una gran playa familiar
2051,hermosa playa un poco cerca hotel viaje rápido en taxi muchos lugares sentarse uno restaurantes de playa local sombra sol elección alquilar equipo de snorkel día ir a contratar guía de snorkel playa limpia gente agradable visto bolsas hacer snorkel llamado taxista listo salir muy disfrutado
2052,fue jugar entrega primer día huatulco quería comer también quería saltar derecho fue una playas podría servicios por carretera llegó numerosos restaurante totalmente encontrado agradable lugar tranquilo comer delicioso pescado a la parrilla todavía vacaciones playa familias llenas realmente grupos familiares niños orilla chalecos salvavidas llenos totalmente también servir ostras frescas a lo largo de la playa
2053,muchos tours en barco dejar de elegir equipo de alquiler siempre bahía últimos dos años tours diferentes gran snorkel nunca comí restaurantes ordenados pareja haciendo snorkel duro en cualquier lugar pesos poco alto cerrar hoteles volver el próximo año ir horas
2054,tomó un taxi tiempo fabuloso bastante ocupado a los lugareños les encantó querer alrededor día destacado tablas lejanas los niños se pondrían tomarían una pieza interesante cerca del área de descanso para la cabeza los niños podían ver peces escuchados ver niños geniales ver vida marina probablemente horas niños tomando muchos restaurantes playa derecha definitivamente regresar visitar huatulco
2055,"Lo siento, la gente hizo snorkel en muchos lugares alrededor del mundo, uno está bien, un corral, necesita algo, para, pescar, abundante, colorido, sierra, pareja, escuelas grandes, simplemente hermoso, aguas limpias y claras, también se proporciona agua de la bahía, generalmente, tranquila, segura, muchos nadadores, experiencia divertida, intentar leer, usar el área, vale la pena visitar."
2056,corto viaje en taxi peso como caminar puerto deportivo tomar panga paseo en bote peso llegar playa playa una mesa local sombrilla necesaria se calienta cervezas frías bebidas comida disponible costo razonable playa encantadora hermosa vista trajo equipo de snorkel alquilar seis agua profunda listo ver pez pequeño agarrar pez resort volverse loco agua calma excelente natación snorkel seguro traer cámara submarina muchos peces vistos se sintió seguro dejando pertenencias mesas
2057,playa coral orilla lejana muchos peces sábado playa todo el día bebiendo cervezas comiendo patatas fritas camarero servido cervezas nosotros dijo propina ya factura algo saber preguntó entrada disfrutar playa pagar
2058,recomendado algo ver disfrutar al llegar poco agradable primera gente silla camino querer pesos realmente agradable probablemente funciona llegó estacionamiento cosa gente intentando vender algo pesos lleno bien se quedó poco tiempo relajante gente rápidamente los viajeros podrían disfrutar lugar mala zona agua agradable
2059,se detuvo ir una pareja probando pesos la gente va a ver playa gratis muy triste al llegar estacionamientos oportunistas muchas playas bonitas menos concurridas oportunistas lo siento estilo
2060,intentando conseguir coche trabajo funcionando número de trabajo vendedores intentando vender algo playa preciosa buceando buena zona vendedores
2061,aguas tranquilas muchos lugares relajarse playa comida disponible mesas con sombra sitio de ciudad lejana ver a lo largo del camino
2062,playa hermosa ocupada gran lugar snorkel lugar para nadar sol leer gente vendiéndonos cosas habituales lugar de playa principalmente disfrutando hermoso paraíso natural arena suave cálida agua clara días perfectos
2063,entrega hermoso ir restaurante semana siempre super super lleno gente ciudad otros ciudad aléjate posible tiempo playa varias veces huatulco persona snorkeling
2064,segundo arrecife taxi del otro extremo taxis generalmente disponibles volver al final del día
2065,playa principal llena de gente nadé pequeña playa enfrente de la principal grandes lotes de coral muchos buenos peces vio buceo buen lugar pasar la tarde
2066,comida de piña agua increíble cristalina diferentes vendedores restaurantes increíbles
2067,enjoyed seeing reef told bit loved
2068,Grandes arrecifes montones de peces coloridos diversión viendo buceo pescar alquiler de equipos baratos buena comida bebida a lo largo de la playa nada realmente
2069,lejos lugar favorito snorkel agarrar almuerzo huatulco fijar día ver cosas gratis pagar comprar almuerzo amor camino de camarones mesa sombra día quiero sol tomar sillas tiempo de playa camarero incluso configurarnos guía de snorkel trabajos nos tomó min trajo toque de pescado paloma nosotros cheque langosta nos mostró cueva nos pagó área de snorkel olas más grandes mucho más tranquilo gran lugar familias también playa gastar precios de taxi establecer tarifa de hotel taxi local casi más barato tomar taxi posible caminado colina uno muchos taxi hacer arreglos conductor regresar obtener precio pagar entrega taxi hacer camino de regreso resort entrega taxi más barato hotel taxi caro viaje en taxi huatulco completo sin viaje entrega disfrutar
2070,taxi resort pesos playa fui a bucear playa mucho lugareños fresco caluroso día de fin de semana equipo de alquiler disponible día no gente pequeños restaurantes sitio beber algo comer seguro salir pertenecer agua el personal podría irse de la mesa nos vería regresar haciendo snorkel en realidad personal mirando la mesa fantástico servicio recomendaría ir disfrutar del tiempo área local uno de los mejores obtener resort pasar el día lugareños
2071,Lo pasamos genial haciendo snorkel guiado las dos primeras veces varias comidas playa bordeada de parejas verdaderamente
2072,hicimos snorkel en diferentes áreas áreas de viaje accesible taxi entrega mejor coral vivo grande frente a la izquierda pequeña playa ver agua izquierda bastante clara tomada entrega restaurante taxista dueño nos consiguió equipo de snorkel a mitad de precio en cualquier otro lugar comida buena cobrada tarifa de sesión baño altamente restaurante de playa también bahía uno pequeño coral vivo más equipo de snorkel restaurante de pesos habitual estacionado comida comprada realmente quiero cobrarnos pesos paraguas cobrarnos estacionamiento recuerde nombre lugar lotes intermedios playa parque cosas necesita sombra pesos baño tomar bahía recorrido en bote nos llevó a la bahía siguiente hacer snorkel hacer snorkeling asegurarse de que el bote vaya despejado hermosa sierra tortugas viaje de regreso
2073,entrega playa realmente genial olas tranquilas perfecto niños pequeños sin embargo fueron botes llenos botes turísticos realmente nadan botes fueron a otra playa como otra cosa como cerca de la playa muy caro conseguí comer pescado muy caro
2074,fue entrega primer día huatulco bonita playa aguas tranquilas costa rocosa snorkel explorar día fue muchos huevos de medusa agua flotante haciendo experiencia huevos nosotros camino agua flotante nadar sin chocar muchos pueden valer la pena amable disfruté restaurante de mariscos decidió nadar huevos
2075,Playa llena de gente Coral muerto Buceo con snorkel Mesas con costo mínimo Paseo en bote turístico La playa recibe muchos visitantes
2076,hermosa playa varios árboles sombra mente grupos grandes otros buen snorkeling a lo largo de rocas izquierda botes dejar turistas grandes multitudes viene cada largo patatas fritas bolsas mesas
2077,nadar buena playa algo estrecha restaurantes ofrecen tumbonas probablemente volvería
2078,fantástico snorkeling muchos peces diferentes tipos hermosos colores coral bueno fue cueva agua clara muy recomendable
2079,me encanta la playa piña mariscos increíble hermoso lugar hacer snorkel
2080,"La segunda zona de playa favorita se llena mucho los fines de semana. Me encanta el restaurante. Primer restaurante. Playa. Bueno, otros. Buen snorkel. Por favor, ponte de pie en el arrecife."
2081,estupenda playa familias niños pequeños rocas traen buen snorkel buena comida me encantó
2082,preciosas vistas increíble agua cristalina hermosos peces olas increíble
2083,lugar genial snorkel muchos peces tortugas arrecife de coral poco lleno seguro equipo limpio vale la pena
2084,playa excelente snorkeling agua clara restaurantes tomar mesa almuerzo definitivamente sugiero venir a hacer el deseo del día
2085,bonitas olas pequeñas capaces de ver peces poco espacio nadar rocas de coral lejos
2086,"Gran pequeña playa, toneladas de snorkel, pequeños restaurantes, pasamos medio día. Me encantó cada minuto."
2087,Otro hermoso día Buceo en la playa Bahía tranquila Buena comida Día de diversión en la playa
2088,la mejor playa huatulco increíble color agua lindos restaurantes equipo de snorkel disponible alquiler
2089,hermosa playa snorkel traje equipo de snorkel oferta alquiler playa final también casilleros disponibles alquiler pesos playa tranquila y segura
2090,entrega excelentes restaurantes playa hacer snorkel increíble seguro comprobar apertura de la cueva estrecho fácil nadar corta distancia cueva pequeña disfrutar
2091,impresionante playa muchos bares restaurantes increíble snorkeling agua cristalina comprar algo bar en la playa sentarse beber día palapa
2092,excelente lugar snorkel bebida almuerzo aguas tranquilas agua clara cerca vienen todos los años
2093,buena playa pasar el día aguas tranquilas buen snorkel varios restaurantes elegir muchos peces ver corral
2094,dos veces pasada hermosa playa ok mucha gente mirando gente mirando la primera vez se cobró mesa extra comida bebidas la segunda vez restaurante diferente dijo cargo extra mesa agregada pesos mesa con sombrilla comida bebidas ordenadas bien volver los vendedores dan mala fama propina en general peso arrancado
2095,playa hay que ver bucear estupendas sillas alquiladas mesa sombrilla presión dio pesos vendedores de presión hay que ver seguro
2096,ir a entrar siempre ir a ver el restaurante de entrega tener buen cuidado cerveza comida fría buen nadar frente al restaurante quiero hacer snorkel ir a la esquina de la cueva necesito saber preguntarle a alguien punto hacer tour de snorkel gran día en la playa
2097,playa pública increíble servicio de restaurantes snorkel excelente agua azul claro comió comida de restaurante servicio increíble muy recomendable
2098,tiempos de nado mejor pez de coral visto área de huatulco visibilidad siempre buena se puede encontrar buen snorkeling
2099,"hermosa playa de arena, buena elección, restaurantes, grandes árboles de sombra y sentarse, excelente snorkeling, agua clara"
2100,"hermosa playa, el mejor snorkel de todos los tiempos, incluso cueva, saber encontrar restaurantes, saber nombrar uno, consiguió asiento temprano, uno primero, la playa parece presión, comprar cualquier cosa, tengo un par de cervezas, pensé que se escaparía, vendedores de la playa, horas agresivas, aunque evite a los chicos, consiga un vehículo, aunque lo deje en paz pronto, necesita servicios, menos equipo."
2101,"Tomé un taxi, hotel, excelente natación, aguas tranquilas, snorkel, muchos restaurantes, playa, asegúrese de traer una toalla, definitivamente recomendaría ir los fines de semana entre semana, lleno de gente, buena comida, restaurantes, pasar el día, recomendaría ir."
2102,Excelentes restaurantes en la playa. Buen snorkel. Recomendaría una semana de playa. Fines de semana muy ocupados.
2103,pasar a los chicos molestos que intentan llegar al restaurante hermosa experiencia de playa en el extremo izquierdo excelente snorkel nadar siguiendo el final de la roca otra pequeña playa a la vuelta de la esquina bastante restaurantes lugares alquilar equipo de snorkel necesita agua cálida calma
2104,elija las playas entrega un poco más grande hermosa arena suave muchos servicios de estacionamiento disponibles definitivamente vale la pena detenerse
2105,fuimos a hacer snorkel en la playa olas súper tranquilas pudimos ver diferentes tipos de peces coral guía nos llevó pequeños súper divertidos
2106,mejor snorkeling playa de arrecife de coral nadar tal vez yardas aguas cristalinas pies de arrecife arrecife profundo blanco ver nuevo en toda el área muchos peces mejor ir a la playa de la mañana multitudes mostrar aguas más cerca playa medio restaurantes playa también alquilar equipo de snorkel cerveza guacamole entrega excelente natación de la mañana
2107,hermosa playa aguas cristalinas olas hermoso lugar de snorkel tour el chico alquiló el equipo de snorkel nos llevó a hacer snorkel también alimentar a los peces en la cueva bucear peces fue una experiencia increíble
2108,Pasé la tarde disfruté mucho aguas tranquilas snorkel incluso personas nadadores alquilan equipo de snorkel disfrutan bebida comida restaurantes
2109,tomó taxi huatulco playa entrega snorkeling alquiler de casilleros en la playa del extremo opuesto precios de guía de snorkeling casilleros razonables playa como piscina agua ofertas de playa adecuadas comida bebidas música actividades acuáticas genial definitivamente regresaría
2110,Me encantó el lugar donde nadé en la cala. Pude ver el crucero. Excelente lugar. Colgar en la playa. Relajarse.
2111,gente intentando llegar restaurantes decidió quedarse playa del árbol increíble nadar perfecto limpio seguro lote de niños restaurantes por persona disfrutó mejor playa nadar con snorkel vi tortuga nadando
2112,Gran lugar para pasar el día en la playa Tomé un taxi en la ciudad Alquilé un bote de regreso Pasé el día en el restaurante Playa Pedir bebidas Día de refrigerio a un precio razonable Podría nadar hacer snorkel Caminar en la playa Increíble
2113,"playa divertida buenos vendedores de snorkel alimentan a los turistas un poco alquiler de chalecos salvavidas un poco caro, sin embargo, es muy divertido"
2114,paraíso seguro hermosa playa prístina chalecos salvavidas disponibles tomó taxi extremadamente razonable izquierda objetos de valor restaurante área de comida día
2115,elección de lugar sentarse restaurantes ofrecen gratis mesa sillas obtener factura cobrar comió bebió cobrarnos paraguas propina grande sentarse en otro lugar muchos lugares preguntar cargar bucear increíble comprobar cueva
2116,año encontrado precios playas altas servicio de la ciudad realmente restaurante de playa decir saber relajado mirar a su alrededor alguien cada vez buscado plato sucio comida nunca elegida varios empleados caminaron bahía obtener nombre restaurante
2117,increíble snorkel pequeña bahía muchos restaurantes minutos lado de la ciudad gran número de guías se acercan llegada pagando guía realmente loco mejor snorkel izquierda número de bahía gente ya agua
2118,Hice snorkel dos veces encontré mucha experiencia otros dijeron arrecife increíble muchos restaurantes de playa uso mental mesas snorkel compraría algo comer beber lugar pintoresco experiencia diferente viaje corto en taxi resort
2119,"Probablemente la mejor playa de Huatulco, nadar, hacer snorkel, sin embargo, los vendedores de restaurantes van bastante a la derecha de la playa, evitan tomar un taxi."
2120,hermosa playa cala protegida fue por primera vez restaurantes cinco años pared pared restaurantes un extremo playa área derecha botes tirar servicio de comida restaurante siempre desaparecido
2121,pasar el día surfear protegido siempre cálido almuerzo para llevar comer cualquiera de las dos excelentes opciones
2122,Ir a cerveza Vistas baratas Traer un taxi para quedarse durante el día
2123,"Traiga un plan general, compre algo, mucha diversión, snorkel, principiante, taxi, caminó."
2124,escaparse principalmente playas ir principalmente familias lugar de playa de vacaciones excelente comida precio justo excelente lugar bucear playa adecuada peso barato paseo en taxi fui días fila
2125,la familia tomó un corto viaje en taxi en la playa para bucear con esnórquel prueba restaurantes resort playa ubicada ensenada natural olas protegidas esnórquel en condiciones difíciles entrega perfecta se acercó recorrido local ofrecido guíanos primero el esnórquel nos llevó por el área nos mostró cosas excelentes comida sol playa aguas tranquilas excelente manera barata conseguir día de resort excelente momento
2126,entrega relajante playa agua clara y tranquila genial nadar snorkel grupo palapa restaurantes ofrecidos variedad mariscos lindo lugar llevar familia
2127,comida delicioso servicio ve a preguntar bien toalla de playa dejada atrás encontrada guardada devuelta un par de horas después
2128,playa larga pareja metros lleno océano como barcos turísticos traer grupos hacer snorkel ok mejor principiante sería bueno ver peces pequeño coral vivo restaurantes línea playa oferta sombra definitivamente hay que verlo
2129,suave playa pareja metros largos restaurantes ofrecen comida bebida sombra gente abarrotada como océano uno mejores lugares área de snorkel barcos para bucear traer gente bastante experimentada encontrar bucear ver peces un poco coral vivo agua tranquilo verdadero principiante llamaría bucear con snorkel bueno definitivamente hay que ver ubicación
2130,bonita playa agua clara snorkeling malos barcos mantenidos a un lado de la playa lejos los nadadores se ponen muy ocupados barcos traer tours muchos restaurantes elegir conseguir bonitos restaurantes llenos al lado agua hace
2131,visité la playa un par de veces a la semana agua cristalina buceando excelente manera pasar el tiempo saludado inmediatamente alguien tratando de sentarse en las mesas otro agregar cargo por servicio factura comentario negativo evitaría las mesas rojas blancas simplemente viajar taxista detener vista del faro
2132,mirar restaurante camarero primero en llegar sillas descansar camarero intentó factura quedó atrapado quería camino habló estacionamiento cosa camarero mal nombre paraíso huatulco liderar creer otros cuidado mantener
2133,aguas tranquilas y limpias nadar snorkel cerveza mirar ya que el restaurante comió cargo por servicio adicional
2134,Fui en taxi al hotel y pasé el día entero increíble increíble haciendo snorkel agua azul limpio toneladas restaurantes elige haz que te sientas en casa gente extremadamente amable seguro amado
2135,excelente lugar para ir día playa excelente snorkel peso taxi pesos resort uno dueños de restaurantes se reúnen guardar cosas restaurante playa alquiler de máscaras pesos pesos incluyendo aletas realmente necesito excelente comida bebida restaurantes dicen que la gente va bien
2136,playa fácil conseguir una maravillosa playa para hacer snorkel muchos lugares comer tiendas comprar niños bastante protegidos hacer mejor visitar la playa familias niños pequeños
2137,bonita y pequeña vista de la bahía hacer snorkel buena comida cosa limpia traer toallas sillas cualquier otra cosa
2138,encantadora playa de arena restaurantes bordeados tiendas de playa playa para bucear fácil seguro marea fuerte coral playa lejana pescado de sierra precios de restaurantes rumbo más alto área del puerto deportivo esperado buen día de playa
2139,Playa pública fines de semana concurridos fantásticos entre semana comida bebida precio razonable calidad
2140,Pasé la temporada de vacaciones increíblemente ocupado dijo que todavía disfruté de la playa nunca fui a bucear toneladas de personas se sentaron en el restaurante cervezas conseguir mesa silla paraguas
2141,playa carretera de fácil acceso barco se llena mejor momento para visitar primera mitad de la mañana visibilidad excelente snorkeling bueno se llena ruidoso
2142,Llegó temprano en la mañana Colocar sombrillas Sillas Playa ocupada Fui a hacer snorkel Regrese temprano Medusa Ver días Nuevas medusas Vienen muchos peces Ver Izquierda Temprano en la tarde Playa llena Agua Me encantó Recomendar ir Temporada de vacaciones Ayuda a menos que esté bien Grandes multitudes Fácil tomar un taxi
2143,uno ir playas entrega snorkel nadar flotar kayak soporte tabla bote de remos amar comida entrega restaurante sentarse relajarse comer beber buena comida
2144,gran playa buen snorkel llegar temprano los lugares se llenan especialmente los fines de semana servicio de comida bueno tomar un taxi recoger horas más tarde
2145,primera vez año último amado pequeño lugar pintoresco snorkel flotador agua restaurantes excelente buena comida geniales alquilados chaleco salvavidas tienda final snorkel tomó taxista nos llevó luz arriba primero excelentes vistas
2146,playa hermosa limpia calma perfecto los niños necesitan alquilar sombrilla sombra muchos restaurantes alquiler de comida local equipo de snorkel pesos día preguntar casillero precio incluido arrecife de coral agradable sierra muchos peces hija disfrutó mucho regresar hotel de playa preguntar parada de taxi mirador nada lugar ver tomar bahías impresionantes
